{
  "clickbait_patterns": [
    "you won't believe",
    "you will not believe",
    "leaves everyone stunned",
    "leave everyone stunned",
    "goes viral",
    "goes viral on",
    "netizens react",
    "netizens divided",
    "what happens next",
    "wait for it",
    "the real reason",
    "this is why",
    "x reasons why",
    "reasons why",
    "top 10",
    "top 5",
    "top 3",
    "must read",
    "never do this",
    "one weird trick",
    "shocking",
    "biggest mistake",
    "secret of",
    "do not miss",
    "breaking: live",
    "fact check: did",
    "fact check: is"
  ],
  "gossip_terms": [
    "gossip",
    "affair",
    "dating",
    "breakup",
    "break-up",
    "feud",
    "trolling",
    "backlash over post",
    "roast"
  ],
  "celebrity_terms": [
    "bollywood",
    "tollywood",
    "kollywood",
    "sandalwood",
    "mollywood",
    "filmfare",
    "box office",
    "ott release",
    "film release",
    "movie trailer",
    "music video",
    "celebrity",
    "star kid",
    "item number",
    "red carpet",
    "award function"
  ],
  "astrology_terms": [
    "horoscope",
    "astrology",
    "astrologer",
    "zodiac",
    "rashifal",
    "kundli",
    "tarot",
    "numerology",
    "palmistry",
    "vastu",
    "lucky number",
    "lucky colour",
    "lucky color",
    "graha"
  ],
  "rumour_terms": [
    "rumour",
    "rumor",
    "unconfirmed reports",
    "allegedly viral",
    "claims going viral",
    "social media claims",
    "netizens claim",
    "video doing rounds",
    "circulating online",
    "went viral on",
    "reportedly" 
  ],
  "routine_official_patterns": [
    "auction of dated securities",
    "auction notice",
    "e-tender",
    "tender notice",
    "expression of interest",
    "request for proposal",
    "request for quotation",
    "meeting schedule",
    "agenda for the meeting",
    "list of holidays",
    "office memorandum",
    "notice board",
    "calendar of",
    "appointment order",
    "transfer order",
    "standard operating procedure",
    "advisory for",
    "revised operating procedure",
    "result of auction",
    "extension of date",
    "datesheet",
    "revised schedule",
    "commencement of"
  ],
  "sports_minor_patterns": [
    "match preview",
    "probable xi",
    "playing xi",
    "playing 11",
    "warm-up match",
    "practice session",
    "net session",
    "press conference ahead",
    "points table",
    "fantasy",
    "dream team",
    "prediction",
    "head to head",
    "team news",
    "injury update",
    "fixture",
    "match today",
    "how to watch",
    "squad update"
  ],
  "opinion_markers": [
    "op-ed",
    "opinion:",
    "opinion piece",
    "column:",
    "first person:",
    "i believe",
    "in my view",
    "viewpoint",
    "editorial opinion"
  ],
  "filler_phrases": [
    "this is a breaking news story",
    "this is breaking news",
    "this is an important development",
    "this is a developing story",
    "the story is developing",
    "more details are expected",
    "more details will follow",
    "more details will be provided",
    "follow for more",
    "follow for updates",
    "stay tuned",
    "stay tuned for updates",
    "this story will be updated",
    "we will update this story",
    "read more",
    "read the full story",
    "watch this space"
  ],
  "excluded_topics": [
    "horoscope",
    "kundli",
    "rashifal",
    "vastu",
    "tarot",
    "numerology",
    "palmistry",
    "diwali sale",
    "festive sale",
    "lucky",
    "mystic",
    "astrology"
  ]
}
